{
  "fact_sheet_version": "1.1.0",
  "context": {
    "kind": "matchup",
    "game_id": "2026_04_KC_BAL",
    "season": 2026,
    "team": "KC",
    "opponent": "BAL",
    "role": "OC"
  },
  "derived": null,
  "facts": [
    {
      "id": "KC.off.2026.overall.all.epa_per_play",
      "label": "KC offense: EPA/play, all plays",
      "value": 0.3075,
      "display": "+0.31",
      "unit": "epa",
      "n": 192,
      "low_sample": false,
      "league_value": 0,
      "league_display": "0.00"
    },
    {
      "id": "KC.off.2026.overall.all.success_rate",
      "label": "KC offense: success rate, all plays",
      "value": 0.625,
      "display": "63%",
      "unit": "rate",
      "n": 192,
      "low_sample": false,
      "league_value": 0.4564,
      "league_display": "46%"
    },
    {
      "id": "KC.off.2026.overall.all.pass_rate",
      "label": "KC offense: pass rate, all plays",
      "value": 0.6458,
      "display": "65%",
      "unit": "rate",
      "n": 192,
      "low_sample": false,
      "league_value": 0.5899,
      "league_display": "59%"
    },
    {
      "id": "KC.off.2026.overall.all.proe",
      "label": "KC offense: pass rate over expected, all plays",
      "value": 0.1662,
      "display": "17%",
      "unit": "rate",
      "n": 192,
      "low_sample": false,
      "league_value": 0.011,
      "league_display": "1%"
    },
    {
      "id": "KC.off.2026.overall.all.explosive_rate",
      "label": "KC offense: explosive-play rate, all plays",
      "value": 0.1458,
      "display": "15%",
      "unit": "rate",
      "n": 192,
      "low_sample": false,
      "league_value": 0.0967,
      "league_display": "10%"
    },
    {
      "id": "KC.off.2026.down_dist.d1-long.pass_rate",
      "label": "KC offense: pass rate, 1st & long",
      "value": 0.6408,
      "display": "64%",
      "unit": "rate",
      "n": 103,
      "low_sample": false,
      "league_value": 0.5573,
      "league_display": "56%"
    },
    {
      "id": "KC.off.2026.down_dist.d1-long.proe",
      "label": "KC offense: pass rate over expected, 1st & long",
      "value": 0.1725,
      "display": "17%",
      "unit": "rate",
      "n": 103,
      "low_sample": false,
      "league_value": 0.0108,
      "league_display": "1%"
    },
    {
      "id": "KC.off.2026.down_dist.d1-long.success_rate",
      "label": "KC offense: success rate, 1st & long",
      "value": 0.6019,
      "display": "60%",
      "unit": "rate",
      "n": 103,
      "low_sample": false,
      "league_value": 0.4396,
      "league_display": "44%"
    },
    {
      "id": "KC.off.2026.down_dist.d1-long.play_action_rate",
      "label": "KC offense: play-action rate, 1st & long",
      "value": 0.3636,
      "display": "36%",
      "unit": "rate",
      "n": 103,
      "low_sample": false,
      "league_value": 0.244,
      "league_display": "24%"
    },
    {
      "id": "KC.off.2025.down_dist.d3-short.pass_rate",
      "label": "KC offense: pass rate, 3rd & short (2025)",
      "value": 0.64,
      "display": "64%",
      "unit": "rate",
      "n": 50,
      "low_sample": false,
      "league_value": 0.5391,
      "league_display": "54%"
    },
    {
      "id": "KC.off.2025.down_dist.d3-short.success_rate",
      "label": "KC offense: success rate, 3rd & short (2025)",
      "value": 0.8,
      "display": "80%",
      "unit": "rate",
      "n": 50,
      "low_sample": false,
      "league_value": 0.635,
      "league_display": "64%"
    },
    {
      "id": "KC.off.2025.down_dist.d3-short.run_success_rate",
      "label": "KC offense: run success rate, 3rd & short (2025)",
      "value": 0.7222,
      "display": "72%",
      "unit": "rate",
      "n": 50,
      "low_sample": false,
      "league_value": 0.6961,
      "league_display": "70%"
    },
    {
      "id": "KC.off.2025.down_dist.d3-long.pass_success_rate",
      "label": "KC offense: dropback success rate, 3rd & long (2025)",
      "value": 0.5,
      "display": "50%",
      "unit": "rate",
      "n": 58,
      "low_sample": false,
      "league_value": 0.433,
      "league_display": "43%"
    },
    {
      "id": "KC.off.2025.down_dist.d3-long.sack_rate",
      "label": "KC offense: sack rate, 3rd & long (2025)",
      "value": 0.0682,
      "display": "7%",
      "unit": "rate",
      "n": 58,
      "low_sample": false,
      "league_value": 0.0696,
      "league_display": "7%"
    },
    {
      "id": "KC.off.2025.down_dist.d3-long.screen_rate",
      "label": "KC offense: screen rate, 3rd & long (2025)",
      "value": 0.1591,
      "display": "16%",
      "unit": "rate",
      "n": 58,
      "low_sample": false,
      "league_value": 0.0854,
      "league_display": "9%"
    },
    {
      "id": "KC.off.2026.zone.red_zone.pass_rate",
      "label": "KC offense: pass rate, red zone",
      "value": 0.5676,
      "display": "57%",
      "unit": "rate",
      "n": 37,
      "low_sample": false,
      "league_value": 0.5115,
      "league_display": "51%"
    },
    {
      "id": "KC.off.2026.zone.red_zone.success_rate",
      "label": "KC offense: success rate, red zone",
      "value": 0.7027,
      "display": "70%",
      "unit": "rate",
      "n": 37,
      "low_sample": false,
      "league_value": 0.4354,
      "league_display": "44%"
    },
    {
      "id": "KC.off.2026.zone.red_zone.epa_per_play",
      "label": "KC offense: EPA/play, red zone",
      "value": 0.4005,
      "display": "+0.40",
      "unit": "epa",
      "n": 37,
      "low_sample": false,
      "league_value": -0.0454,
      "league_display": "-0.05"
    },
    {
      "id": "BAL.def.2026.overall.all.epa_per_play",
      "label": "BAL defense: EPA/play, all plays",
      "value": -0.0968,
      "display": "-0.10",
      "unit": "epa",
      "n": 205,
      "low_sample": false,
      "league_value": 0,
      "league_display": "0.00"
    },
    {
      "id": "BAL.def.2026.overall.all.success_rate",
      "label": "BAL defense: success rate, all plays",
      "value": 0.3902,
      "display": "39%",
      "unit": "rate",
      "n": 205,
      "low_sample": false,
      "league_value": 0.4564,
      "league_display": "46%"
    },
    {
      "id": "BAL.def.2026.overall.all.explosive_rate",
      "label": "BAL defense: explosive-play rate, all plays",
      "value": 0.078,
      "display": "8%",
      "unit": "rate",
      "n": 205,
      "low_sample": false,
      "league_value": 0.0967,
      "league_display": "10%"
    },
    {
      "id": "BAL.def.2026.overall.all.blitz_rate",
      "label": "BAL defense: blitz rate, all plays",
      "value": 0.4065,
      "display": "41%",
      "unit": "rate",
      "n": 205,
      "low_sample": false,
      "league_value": 0.2663,
      "league_display": "27%"
    },
    {
      "id": "BAL.def.2026.down_dist.d1-long.success_rate",
      "label": "BAL defense: success rate, 1st & long",
      "value": 0.3412,
      "display": "34%",
      "unit": "rate",
      "n": 85,
      "low_sample": false,
      "league_value": 0.4396,
      "league_display": "44%"
    },
    {
      "id": "BAL.def.2026.down_dist.d1-long.run_success_rate",
      "label": "BAL defense: run success rate, 1st & long",
      "value": 0.2353,
      "display": "24%",
      "unit": "rate",
      "n": 85,
      "low_sample": false,
      "league_value": 0.3848,
      "league_display": "38%"
    },
    {
      "id": "BAL.def.2026.down_dist.d1-long.pass_success_rate",
      "label": "BAL defense: dropback success rate, 1st & long",
      "value": 0.4118,
      "display": "41%",
      "unit": "rate",
      "n": 85,
      "low_sample": false,
      "league_value": 0.4831,
      "league_display": "48%"
    },
    {
      "id": "BAL.def.2026.down_dist.d1-long.explosive_rate",
      "label": "BAL defense: explosive-play rate, 1st & long",
      "value": 0.0588,
      "display": "6%",
      "unit": "rate",
      "n": 85,
      "low_sample": false,
      "league_value": 0.1071,
      "league_display": "11%"
    },
    {
      "id": "BAL.def.2025.down_dist.d3-short.success_rate",
      "label": "BAL defense: success rate, 3rd & short (2025)",
      "value": 0.4583,
      "display": "46%",
      "unit": "rate",
      "n": 48,
      "low_sample": false,
      "league_value": 0.635,
      "league_display": "64%"
    },
    {
      "id": "BAL.def.2025.down_dist.d3-short.run_success_rate",
      "label": "BAL defense: run success rate, 3rd & short (2025)",
      "value": 0.5238,
      "display": "52%",
      "unit": "rate",
      "n": 48,
      "low_sample": false,
      "league_value": 0.6961,
      "league_display": "70%"
    },
    {
      "id": "BAL.def.2025.down_dist.d3-short.blitz_rate",
      "label": "BAL defense: blitz rate, 3rd & short (2025)",
      "value": 0.5185,
      "display": "52%",
      "unit": "rate",
      "n": 48,
      "low_sample": false,
      "league_value": 0.2619,
      "league_display": "26%"
    },
    {
      "id": "BAL.def.2025.down_dist.d3-long.pass_success_rate",
      "label": "BAL defense: dropback success rate, 3rd & long (2025)",
      "value": 0.3968,
      "display": "40%",
      "unit": "rate",
      "n": 79,
      "low_sample": false,
      "league_value": 0.433,
      "league_display": "43%"
    },
    {
      "id": "BAL.def.2025.down_dist.d3-long.blitz_rate",
      "label": "BAL defense: blitz rate, 3rd & long (2025)",
      "value": 0.7619,
      "display": "76%",
      "unit": "rate",
      "n": 79,
      "low_sample": false,
      "league_value": 0.4034,
      "league_display": "40%"
    },
    {
      "id": "BAL.def.2025.down_dist.d3-long.man_rate",
      "label": "BAL defense: man coverage rate, 3rd & long (2025)",
      "value": 0.254,
      "display": "25%",
      "unit": "rate",
      "n": 79,
      "low_sample": false,
      "league_value": 0.4271,
      "league_display": "43%"
    },
    {
      "id": "BAL.def.2026.zone.red_zone.success_rate",
      "label": "BAL defense: success rate, red zone",
      "value": 0.3793,
      "display": "38%",
      "unit": "rate",